№,Процесс,Обратимость,Объект изменения,Принцип,Режимы реализации,Уникальность/Аналоги
192,глия-опосредованная пластичность— нарушение,Да,экономика/обмен,закон химической кинетики,постепенные; неформальные; мгновенные; каскадные,Схожие процессы существуют
193,долговременная депрессия— модуляция,Условно,память/наследие,принцип Хебба,дискретные; каскадные; эндогенные,Аналоги в других системах
194,рост дендритных шипиков— нарушение,Условно,тело/материя,закон химической кинетики,индивидуальные; цикличные,Схожие процессы существуют
195,эпигенетическая пластичность,Нет,время/ритм,доктрина нейрона,возможные; явные; мгновенные,Аналоги в других системах
196,восстановление после травмы— ингибиция,Условно,память/наследие,принцип Хебба,экзогенные; возможные; институциональные; латентные,Аналоги в других системах
197,апоптоз ненужных нейронов,Условно,институты,принцип конкурентного ингибирования,явные; индивидуальные; мгновенные,Схожие процессы существуют
198,перепрограммирование нейронов— модуляция,Да,отношения,принцип пластичности,постепенные; дискретные,Аналоги в других системах
199,фенотипическая пластичность— нарушение,Условно,отношения,закон химической кинетики,институциональные; латентные; явные; коллективные,Уникальный процесс
200,ремиелинизация,Да,значения,эвристика стохастического резонанса,институциональные; мгновенные; каскадные; континуальные,Аналоги в других системах
