№,Процесс,Обратимость,Объект изменения,Принцип,Режимы реализации,Уникальность/Аналоги
1,рост аксонов— модуляция,Условно,содержание,закон химической кинетики,неформальные; эндогенные,Схожие процессы существуют
2,демиелинизация— ингибиция,Условно,институты,принцип Хебба,континуальные; цикличные; возможные; экзогенные,Уникальный процесс
3,синаптическая перестройка— ингибиция,Да,тело/материя,эвристика обратной связи,институциональные; возможные,Схожие процессы существуют
4,аксональное прорыв,Условно,дискурс,правило специфичности,неформальные; явные; мгновенные,Схожие процессы существуют
5,восстановление памяти— модуляция,Нет,время/ритм,закон сохранения энергии,эндогенные; дискретные; постепенные; возможные,Аналоги в других системах
6,долговременная депрессия— активация,Нет,идентичность/границы,эвристика обратной связи,коллективные; неформальные,Уникальный процесс
7,синаптическая перестройка— регуляция,Да,время/ритм,доктрина нейрона,коллективные; цикличные; неформальные; каскадные,Уникальный процесс
8,быстрая пластичность— активация,Нет,функция,закон химической кинетики,цикличные; континуальные,Схожие процессы существуют
9,фенотипическая пластичность— ингибиция,Условно,технология/инфраструктура,принцип Хебба,коллективные; экзогенные; индивидуальные,Аналоги в других системах
10,медленная пластичность— активация,Нет,поведение,правило специфичности,коллективные; институциональные; экзогенные; эндогенные,Уникальный процесс
11,перестройка зрительной коры— активация,Да,память/наследие,закон сохранения энергии,латентные; индивидуальные,Схожие процессы существуют
12,контекст-зависимая пластичность— модуляция,Нет,дискурс,закон химической кинетики,неформальные; мгновенные; постепенные; дискретные,Аналоги в других системах
13,перестройка зрительной коры— модуляция,Нет,отношения,принцип минимальной энергии,мгновенные; возможные; институциональные; явные,Схожие процессы существуют
14,гомеостатическая пластичность— регуляция,Нет,экономика/обмен,принцип пластичности,неформальные; эндогенные; каскадные; постепенные,Аналоги в других системах
15,глутаматергическая пластичность— модуляция,Условно,значения,принцип пластичности,коллективные; дискретные,Уникальный процесс
16,формирование новых синапсов,Нет,состояние,принцип Хебба,латентные; континуальные; неформальные,Уникальный процесс
17,габА-ергическая пластичность— ингибиция,Условно,память/наследие,закон сохранения энергии,коллективные; индивидуальные,Схожие процессы существуют
18,реабилитационная пластичность— нарушение,Нет,нормы,доктрина нейрона,латентные; неформальные,Аналоги в других системах
19,реабилитационная пластичность— ингибиция,Нет,экономика/обмен,гомеостаз,мгновенные; эндогенные,Схожие процессы существуют
20,прореживание синапсов,Условно,время/ритм,принцип конкурентного ингибирования,латентные; дискретные; возможные; коллективные,Схожие процессы существуют
21,демиелинизация— регуляция,Да,нормы,эвристика стохастического резонанса,каскадные; эндогенные; возможные; индивидуальные,Схожие процессы существуют
22,стресс-индуцированная пластичность— ингибиция,Да,поведение,правило специфичности,эндогенные; институциональные; континуальные,Аналоги в других системах
23,метапластичность— модуляция,Условно,тело/материя,принцип Хебба,неформальные; эндогенные,Схожие процессы существуют
24,эпигенетическая пластичность— модуляция,Нет,память/наследие,принцип конкурентного ингибирования,коллективные; континуальные,Аналоги в других системах
25,реабилитационная пластичность— модуляция,Нет,структура,принцип пластичности,цикличные; институциональные; постепенные; возможные,Схожие процессы существуют
26,мускариновая пластичность,Условно,структура,закон химической кинетики,явные; цикличные,Уникальный процесс
27,демиелинизация,Да,память/наследие,принцип минимальной энергии,постепенные; индивидуальные; институциональные,Схожие процессы существуют
28,рост новых нейронов (нейрогенез)— активация,Нет,структура,принцип конкурентного ингибирования,цикличные; мгновенные; постепенные,Схожие процессы существуют
29,рост аксонов— нарушение,Условно,технология/инфраструктура,принцип конкурентного ингибирования,институциональные; континуальные,Аналоги в других системах
30,таламокортикальная пластичность— модуляция,Да,память/наследие,законы электрофизиологии,дискретные; экзогенные; неформальные,Аналоги в других системах
31,миелиновая пластичность— регуляция,Нет,дискурс,законы диффузии,индивидуальные; каскадные; возможные; коллективные,Схожие процессы существуют
32,разрушение синапсов,Нет,экономика/обмен,эвристика прогнозирования,каскадные; необходимые,Уникальный процесс
33,миелиновая пластичность— модуляция,Да,значения,доктрина нейрона,необходимые; институциональные; возможные,Аналоги в других системах
34,стресс-индуцированная пластичность— нарушение,Да,время/ритм,законы электрофизиологии,институциональные; явные; мгновенные,Уникальный процесс
35,глия-опосредованная пластичность— активация,Да,нормы,законы электрофизиологии,институциональные; возможные; неформальные,Аналоги в других системах
36,миелиновая пластичность,Нет,дискурс,принцип приспособления,возможные; цикличные,Схожие процессы существуют
37,аксональное прорыв— ингибиция,Условно,экономика/обмен,принцип пластичности,цикличные; институциональные; дискретные; возможные,Схожие процессы существуют
38,кортикостриатная пластичность— модуляция,Условно,структура,эвристика прогнозирования,континуальные; экзогенные; мгновенные,Аналоги в других системах
39,уплотнение синаптической плотности,Условно,технология/инфраструктура,законы электрофизиологии,континуальные; дискретные; явные; эндогенные,Уникальный процесс
40,формирование новых синапсов— нарушение,Да,идентичность/границы,принцип минимальной энергии,дискретные; континуальные,Уникальный процесс
41,стресс-индуцированная пластичность— модуляция,Нет,экономика/обмен,закон химической кинетики,возможные; каскадные; постепенные; явные,Аналоги в других системах
42,восстановление после травмы— модуляция,Да,институты,законы диффузии,латентные; эндогенные; мгновенные; явные,Уникальный процесс
43,габА-ергическая пластичность— модуляция,Нет,символы,принцип приспособления,явные; неформальные; возможные,Уникальный процесс
44,стресс-индуцированная пластичность,Да,структура,законы диффузии,латентные; цикличные; экзогенные,Аналоги в других системах
45,таламокортикальная пластичность— активация,Да,память/наследие,принцип конкурентного ингибирования,необходимые; цикличные,Уникальный процесс
46,глутаматергическая пластичность,Условно,память/наследие,доктрина нейрона,индивидуальные; экзогенные; постепенные; каскадные,Схожие процессы существуют
47,аксональное прорыв— модуляция,Условно,структура,принцип приспособления,возможные; коллективные; мгновенные; явные,Уникальный процесс
48,коллатеральное прорастание аксонов— ингибиция,Нет,тело/материя,законы электрофизиологии,экзогенные; эндогенные,Уникальный процесс
49,хеббовская пластичность— активация,Нет,дискурс,принцип пластичности,мгновенные; институциональные; коллективные; экзогенные,Уникальный процесс
50,увеличение длины дендритов— активация,Условно,идентичность/границы,принцип Хебба,индивидуальные; каскадные; возможные,Аналоги в других системах
51,метапластичность,Условно,пространство,закон химической кинетики,неформальные; институциональные,Аналоги в других системах
52,глия-опосредованная пластичность— модуляция,Да,символы,эвристика стохастического резонанса,коллективные; экзогенные; мгновенные,Схожие процессы существуют
53,синаптическая перестройка— нарушение,Условно,функция,гомеостаз,институциональные; возможные; эндогенные; латентные,Аналоги в других системах
54,миелиновая пластичность— активация,Нет,время/ритм,принцип Хебба,институциональные; латентные,Уникальный процесс
55,обучение-индуцированная пластичность— ингибиция,Нет,структура,законы электрофизиологии,коллективные; латентные; постепенные; дискретные,Аналоги в других системах
56,восстановление памяти— активация,Нет,состояние,эвристика стохастического резонанса,дискретные; континуальные; неформальные; явные,Уникальный процесс
57,мускариновая пластичность— регуляция,Нет,память/наследие,принцип конкурентного ингибирования,неформальные; постепенные; институциональные; латентные,Уникальный процесс
58,фенотипическая пластичность— регуляция,Условно,идентичность/границы,принцип Хебба,институциональные; неформальные; эндогенные,Уникальный процесс
59,фенотипическая пластичность,Нет,символы,эвристика стохастического резонанса,коллективные; возможные; неформальные,Схожие процессы существуют
60,реабилитационная пластичность— активация,Условно,идентичность/границы,принцип минимальной энергии,каскадные; мгновенные,Уникальный процесс
61,опыт-зависимая пластичность— ингибиция,Нет,значения,принцип приспособления,институциональные; мгновенные; цикличные; необходимые,Аналоги в других системах
62,реорганизация кортикальной карты— модуляция,Да,память/наследие,закон сохранения энергии,необходимые; экзогенные; институциональные,Уникальный процесс
63,долговременная потенциация— модуляция,Да,институты,закон химической кинетики,явные; индивидуальные; постепенные; дискретные,Уникальный процесс
64,эпигенетическая пластичность— регуляция,Нет,время/ритм,доктрина нейрона,каскадные; явные,Уникальный процесс
65,исчезновение следов памяти— модуляция,Нет,время/ритм,эвристика стохастического резонанса,необходимые; явные; неформальные,Уникальный процесс
66,перестройка зрительной коры— нарушение,Условно,институты,принцип приспособления,экзогенные; институциональные; явные; постепенные,Схожие процессы существуют
67,стресс-индуцированная пластичность— регуляция,Нет,тело/материя,принцип пластичности,экзогенные; возможные; континуальные,Схожие процессы существуют
68,хеббовская пластичность— модуляция,Да,память/наследие,эвристика обратной связи,постепенные; латентные,Аналоги в других системах
69,регуляция рецепторной чувствительности— активация,Нет,функция,принцип минимальной энергии,континуальные; латентные; институциональные,Схожие процессы существуют
70,реорганизация кортикальной карты— активация,Условно,отношения,принцип Хебба,дискретные; коллективные; явные; институциональные,Уникальный процесс
71,медленная пластичность— нарушение,Нет,структура,принцип приспособления,цикличные; дискретные; возможные,Схожие процессы существуют
72,протеосинтетическая пластичность— активация,Да,состояние,принцип конкурентного ингибирования,эндогенные; дискретные; явные; индивидуальные,Схожие процессы существуют
73,восстановление памяти— нарушение,Нет,технология/инфраструктура,принцип Хебба,постепенные; латентные; цикличные; мгновенные,Уникальный процесс
74,миелиновая пластичность— нарушение,Условно,значения,закон химической кинетики,эндогенные; мгновенные; постепенные; каскадные,Аналоги в других системах
75,коллатеральное прорастание аксонов,Условно,функция,принцип конкурентного ингибирования,мгновенные; коллективные; цикличные,Схожие процессы существуют
76,апоптоз ненужных нейронов— активация,Условно,состояние,гомеостаз,каскадные; постепенные,Аналоги в других системах
77,опыт-зависимая пластичность,Условно,технология/инфраструктура,законы диффузии,институциональные; каскадные; неформальные; латентные,Уникальный процесс
78,формирование новых синапсов— ингибиция,Нет,функция,эвристика стохастического резонанса,возможные; неформальные,Аналоги в других системах
79,быстрая пластичность,Нет,институты,правило специфичности,явные; экзогенные; возможные,Аналоги в других системах
80,рост новых нейронов (нейрогенез)— ингибиция,Да,память/наследие,принцип приспособления,континуальные; дискретные; индивидуальные,Аналоги в других системах
81,синаптическая конкуренция— модуляция,Нет,память/наследие,правило специфичности,цикличные; явные; институциональные; эндогенные,Уникальный процесс
82,миелиновая пластичность— ингибиция,Нет,пространство,эвристика прогнозирования,дискретные; мгновенные; необходимые; возможные,Уникальный процесс
83,антхеббовская пластичность— активация,Условно,поведение,принцип приспособления,возможные; явные; мгновенные; континуальные,Схожие процессы существуют
84,гомеостатическая пластичность— ингибиция,Да,поведение,гомеостаз,экзогенные; континуальные,Уникальный процесс
85,рост дендритных шипиков— регуляция,Нет,отношения,гомеостаз,континуальные; институциональные; возможные; неформальные,Аналоги в других системах
86,гомеостатическая пластичность— модуляция,Условно,нормы,доктрина нейрона,институциональные; неформальные; явные; коллективные,Уникальный процесс
87,синаптическая перестройка,Условно,структура,принцип приспособления,экзогенные; явные; институциональные; необходимые,Уникальный процесс
88,контекст-зависимая пластичность— активация,Да,идентичность/границы,эвристика обратной связи,латентные; эндогенные; коллективные; явные,Уникальный процесс
89,опыт-зависимая пластичность— модуляция,Условно,отношения,закон химической кинетики,экзогенные; цикличные; каскадные,Аналоги в других системах
90,протеосинтетическая пластичность— ингибиция,Да,функция,принцип Хебба,неформальные; экзогенные; латентные; коллективные,Аналоги в других системах
91,апоптоз ненужных нейронов— модуляция,Условно,состояние,принцип конкурентного ингибирования,дискретные; цикличные; индивидуальные,Уникальный процесс
92,рост дендритных шипиков— ингибиция,Нет,структура,гомеостаз,дискретные; институциональные; цикличные; каскадные,Аналоги в других системах
93,аксональное прорыв— активация,Условно,поведение,принцип приспособления,мгновенные; институциональные; коллективные; латентные,Аналоги в других системах
94,протеосинтетическая пластичность— нарушение,Условно,время/ритм,гомеостаз,мгновенные; институциональные; экзогенные,Уникальный процесс
95,рост новых нейронов (нейрогенез),Да,институты,принцип Хебба,явные; дискретные; возможные; экзогенные,Схожие процессы существуют
96,стресс-индуцированная пластичность— активация,Нет,институты,принцип конкурентного ингибирования,неформальные; экзогенные,Аналоги в других системах
