№,Процесс,Обратимость,Объект изменения,Принцип,Режимы реализации,Уникальность/Аналоги
1,Регулировка высоты стула (адаптация кресла),Да,технология/инфраструктура,Принцип антропометрического соответствия,возможные; мгновенные; индивидуальные; экзогенные,Аналог в эргономике рабочего места
2,Настройка высоты рабочего стола,Да,технология/инфраструктура,Принцип оптимальной рабочей высоты,возможные; мгновенные; индивидуальные,Аналог в эргономике рабочего места
3,Коррекция осанки сидя (поддержка позвоночника),Условно,тело/материя,Принцип нейтральной осанки,возможные; постепенные; индивидуальные; эндогенные,Уникально
4,Оптимизация расстояния и высоты монитора,Да,пространство,Принцип оптимальной дистанции просмотра,мгновенные; индивидуальные,Аналог в интерфейсной и рабочей эргономике
5,Настройка положения клавиатуры и мыши,Да,технология/инфраструктура,Принцип эргономичного расположения,мгновенные; индивидуальные,Аналог в эргономике интерфейсов
6,Использование антифатижного коврика при длительной стоячей работе,Да,технология/инфраструктура,Принцип уменьшения статической нагрузки,возможные; мгновенные; индивидуальные,Аналог в организационной и рабочей эргономике
7,Применение микропауз для снижения усталости,Да,время/ритм,Принцип цикличных пауз,необходимые; цикличные; индивидуальные,Аналог в когнитивной эргономике
8,Подбор эргономичной формы ручек инструмента,Условно,технология/инфраструктура,Принцип биомеханической совместимости,возможные; дискретные; экзогенные,Уникально
9,Использование вспомогательных устройств для подъема тяжестей,Да,технология/инфраструктура,Принцип минимизации переносов,необходимые; дискретные; коллективные,Аналог в транспортной и макроэргономике
10,Внедрение сидя‑стоя рабочих станций,Да,технология/инфраструктура,Принцип смены положения,возможные; цикличные; индивидуальные,Аналог в рабочей эргономике
11,Применение экзоскелетов для поддержки тела,Условно,технология/инфраструктура,Принцип нейромеханической поддержки,возможные; дискретные; индивидуальные,Аналог в нейроэргономике
12,Регулировка угла наклона рабочей поверхности,Да,технология/инфраструктура,Принцип оптимального угла,мгновенные; индивидуальные,Аналог в рабочей эргономике
13,Оптимизация распределения веса при переносе (двуручный хват),Условно,поведение,Принцип распределения веса,постепенные; индивидуальные,Аналог в транспортной эргономике
14,Применение растяжки и разминки перед и после работы,Да,тело/материя,Принцип подготовки мышц,необходимые; цикличные; индивидуальные,Аналог в нейроэргономике
15,Регулировка подлокотников и подставок для ног,Да,технология/инфраструктура,Принцип поддержки конечностей,мгновенные; индивидуальные,Аналог в рабочей эргономике
